{
  "id": "ollama-provider",
  "name": "Ollama AI Provider",
  "description": "Connect Stina to your local Ollama instance for private, offline AI conversations.",
  "author": {
    "name": "einord",
    "url": "https://github.com/einord"
  },
  "repository": "https://github.com/einord/stina-ext-ollama",
  "license": "MIT",
  "categories": ["ai-provider"],
  "verified": true,
  "versions": [
    {
      "version": "1.0.0",
      "releaseDate": "2024-12-28",
      "minStinaVersion": "0.5.0",
      "platforms": ["web", "electron", "tui"],
      "downloadUrl": "https://github.com/einord/stina-ext-ollama/releases/download/v1.0.0/ollama-provider-1.0.0.zip",
      "permissions": [
        "network:localhost:11434",
        "settings.register",
        "provider.register"
      ],
      "changelog": "Initial release"
    }
  ]
}
